{
  "$schema": "https://json-schema.org/draft/2020-12/schema",
  "type": "object",
  "properties": {
    "baseYear": {
      "type": "integer",
      "minimum": 1900,
      "maximum": 2100
    },
    "note": {
      "type": "string",
      "minLength": 1
    },
    "sources": {
      "minItems": 1,
      "type": "array",
      "items": {
        "type": "object",
        "properties": {
          "id": {
            "type": "string",
            "pattern": "^[a-z0-9-]+$"
          },
          "title": {
            "type": "string",
            "minLength": 1
          },
          "url": {
            "type": "string",
            "format": "uri"
          },
          "retrievedOn": {
            "type": "string",
            "pattern": "^\\d{4}(-\\d{2})?(-\\d{2})?$"
          },
          "archiveUrl": {
            "type": "string",
            "format": "uri"
          }
        },
        "required": [
          "title",
          "url"
        ]
      }
    },
    "series": {
      "type": "object",
      "propertyNames": {
        "type": "string",
        "minLength": 3,
        "maxLength": 3
      },
      "additionalProperties": {
        "type": "object",
        "properties": {
          "geo": {
            "type": "string",
            "minLength": 1
          },
          "label": {
            "type": "object",
            "properties": {
              "en": {
                "type": "string",
                "minLength": 1
              }
            },
            "required": [
              "en"
            ],
            "additionalProperties": {
              "type": "string",
              "minLength": 1
            }
          },
          "index": {
            "type": "object",
            "propertyNames": {
              "type": "string",
              "pattern": "^\\d{4}$"
            },
            "additionalProperties": {
              "type": "number",
              "exclusiveMinimum": 0
            }
          }
        },
        "required": [
          "geo",
          "label",
          "index"
        ]
      }
    },
    "$schema": {
      "type": "string",
      "description": "Editor hint. Ignored by the loader."
    }
  },
  "required": [
    "baseYear",
    "note",
    "sources",
    "series"
  ],
  "title": "InfraWorldWide deflator table",
  "$comment": "Generated by scripts/emit-json-schema.ts. Do not edit by hand; run `npm run data:schema`."
}
