{
  "baseYear": 2015,
  "note": "Annual average Harmonised Index of Consumer Prices (all-items, COICOP CP00), 2015 = 100. Used to express costs from different price years in comparable real terms. HICP is a consumer-price proxy: a construction cost index (Eurostat sts_copi_a) would be a closer fit and can be substituted without code changes, since src/lib/deflator.ts consumes any table in this shape. USD is the US CPI-U (all urban consumers, all items, US city average), rebased from its native 1982–84 = 100 basis by dividing by the 2015 annual average of 237.017. That is a national CPI, not an HICP. The Serbian series starts in 2006: Eurostat publishes no annual-average HICP index for Serbia before then, and the 1990s hyperinflation and dinar redenomination make splicing the national CPI onto it unsound, so earlier years are absent rather than estimated. Croatia has no series: the kuna was replaced by the euro on 1 January 2023 at 7.53450 HRK per euro, so an HRK series would end in 2022 and pull the common latest price year of the whole table back from 2025 to 2022. Croatian figures recorded in kuna stay as prose in notes and are not restated; euro figures from 2023 use the euro-area series like every other euro cost. The Czech series is Eurostat's HICP for Czechia and starts in 1996, the first year Eurostat publishes it. The Polish series is Eurostat's HICP for Poland and also starts in 1996, the first year Eurostat publishes it. The Hungarian series is Eurostat's HICP for Hungary and also starts in 1996, the first year Eurostat publishes it. The Swedish series is Eurostat HICP for Sweden and starts in 1996, the first year Eurostat publishes it.",
  "sources": [
    {
      "title": "Eurostat: HICP annual data (average index and rate of change) [prc_hicp_aind]",
      "url": "https://ec.europa.eu/eurostat/databrowser/view/prc_hicp_aind/default/table"
    },
    {
      "title": "U.S. Bureau of Labor Statistics, Consumer Price Index for All Urban Consumers: All Items in U.S. City Average [CPIAUCNS], via FRED",
      "url": "https://fred.stlouisfed.org/series/CPIAUCNS"
    }
  ],
  "series": {
    "BGN": {
      "geo": "BG",
      "label": {
        "en": "Bulgaria",
        "ro": "Bulgaria"
      },
      "index": {
        "1997": 40.27,
        "1998": 47.79,
        "1999": 49.02,
        "2000": 54.08,
        "2001": 58.06,
        "2002": 61.44,
        "2003": 62.88,
        "2004": 66.75,
        "2005": 70.78,
        "2006": 76.02,
        "2007": 81.78,
        "2008": 91.55,
        "2009": 93.81,
        "2010": 96.66,
        "2011": 99.94,
        "2012": 102.33,
        "2013": 102.72,
        "2014": 101.08,
        "2015": 100,
        "2016": 98.68,
        "2017": 99.85,
        "2018": 102.48,
        "2019": 104.99,
        "2020": 106.27,
        "2021": 109.3,
        "2022": 123.52,
        "2023": 134.15,
        "2024": 137.63,
        "2025": 142.5
      }
    },
    "CZK": {
      "geo": "CZ",
      "label": {
        "en": "Czechia",
        "ro": "Cehia"
      },
      "index": {
        "1996": 58.8,
        "1997": 63.6,
        "1998": 69.7,
        "1999": 71,
        "2000": 73.8,
        "2001": 77.1,
        "2002": 78.2,
        "2003": 78.2,
        "2004": 80.2,
        "2005": 81.5,
        "2006": 83.2,
        "2007": 85.6,
        "2008": 91,
        "2009": 91.5,
        "2010": 92.6,
        "2011": 94.6,
        "2012": 98,
        "2013": 99.3,
        "2014": 99.8,
        "2015": 100,
        "2016": 100.7,
        "2017": 103.1,
        "2018": 105.1,
        "2019": 107.8,
        "2020": 111.4,
        "2021": 115.1,
        "2022": 132.1,
        "2023": 147.9,
        "2024": 151.9,
        "2025": 155.4
      }
    },
    "EUR": {
      "geo": "EA",
      "label": {
        "en": "Euro area",
        "ro": "Zona euro"
      },
      "index": {
        "1996": 71.74,
        "1997": 72.87,
        "1998": 73.67,
        "1999": 74.48,
        "2000": 76.05,
        "2001": 77.83,
        "2002": 79.58,
        "2003": 81.24,
        "2004": 82.98,
        "2005": 84.79,
        "2006": 86.64,
        "2007": 88.49,
        "2008": 91.38,
        "2009": 91.65,
        "2010": 93.14,
        "2011": 95.66,
        "2012": 98.05,
        "2013": 99.38,
        "2014": 99.81,
        "2015": 100,
        "2016": 100.23,
        "2017": 101.78,
        "2018": 103.56,
        "2019": 104.8,
        "2020": 105.06,
        "2021": 107.78,
        "2022": 116.82,
        "2023": 123.15,
        "2024": 126.07,
        "2025": 128.75
      }
    },
    "HUF": {
      "geo": "HU",
      "label": {
        "en": "Hungary",
        "ro": "Ungaria"
      },
      "index": {
        "1996": 31.76,
        "1997": 37.62,
        "1998": 42.97,
        "1999": 47.25,
        "2000": 51.95,
        "2001": 56.67,
        "2002": 59.64,
        "2003": 62.43,
        "2004": 66.66,
        "2005": 68.98,
        "2006": 71.76,
        "2007": 77.45,
        "2008": 82.12,
        "2009": 85.43,
        "2010": 89.47,
        "2011": 92.98,
        "2012": 98.24,
        "2013": 99.92,
        "2014": 99.94,
        "2015": 100,
        "2016": 100.45,
        "2017": 102.84,
        "2018": 105.84,
        "2019": 109.46,
        "2020": 113.15,
        "2021": 119.04,
        "2022": 137.22,
        "2023": 160.59,
        "2024": 166.56,
        "2025": 173.96
      }
    },
    "PLN": {
      "geo": "PL",
      "label": {
        "en": "Poland",
        "ro": "Polonia"
      },
      "index": {
        "1996": 46.2,
        "1997": 53.1,
        "1998": 59.4,
        "1999": 63.6,
        "2000": 70,
        "2001": 73.8,
        "2002": 75.2,
        "2003": 75.7,
        "2004": 78.5,
        "2005": 80.2,
        "2006": 81.2,
        "2007": 83.3,
        "2008": 86.8,
        "2009": 90.3,
        "2010": 92.7,
        "2011": 96.3,
        "2012": 99.8,
        "2013": 100.6,
        "2014": 100.7,
        "2015": 100,
        "2016": 99.8,
        "2017": 101.4,
        "2018": 102.6,
        "2019": 104.8,
        "2020": 108.6,
        "2021": 114.3,
        "2022": 129.4,
        "2023": 143.5,
        "2024": 148.7,
        "2025": 153.7
      }
    },
    "RON": {
      "geo": "RO",
      "label": {
        "en": "Romania",
        "ro": "România"
      },
      "index": {
        "1996": 3.25,
        "1997": 8.29,
        "1998": 13.19,
        "1999": 19.23,
        "2000": 28.01,
        "2001": 37.66,
        "2002": 46.14,
        "2003": 53.18,
        "2004": 59.51,
        "2005": 64.9,
        "2006": 69.19,
        "2007": 72.58,
        "2008": 78.33,
        "2009": 82.7,
        "2010": 87.73,
        "2011": 92.84,
        "2012": 95.98,
        "2013": 99.04,
        "2014": 100.41,
        "2015": 100,
        "2016": 98.93,
        "2017": 100,
        "2018": 104.08,
        "2019": 108.15,
        "2020": 110.67,
        "2021": 115.21,
        "2022": 129.06,
        "2023": 141.64,
        "2024": 149.91,
        "2025": 160.06
      }
    },
    "RSD": {
      "geo": "RS",
      "label": {
        "en": "Serbia",
        "ro": "Serbia"
      },
      "index": {
        "2006": 55.1,
        "2007": 58.3,
        "2008": 65.2,
        "2009": 70.5,
        "2010": 74.9,
        "2011": 83.3,
        "2012": 89.4,
        "2013": 96.3,
        "2014": 98.5,
        "2015": 100,
        "2016": 101.3,
        "2017": 104.7,
        "2018": 106.8,
        "2019": 108.8,
        "2020": 110.7,
        "2021": 115.2,
        "2022": 128.7,
        "2023": 144.2,
        "2024": 151.1,
        "2025": 157.3
      }
    },
    "USD": {
      "geo": "US",
      "label": {
        "en": "United States",
        "ro": "Statele Unite"
      },
      "index": {
        "1996": 66.18,
        "1997": 67.72,
        "1998": 68.77,
        "1999": 70.28,
        "2000": 72.65,
        "2001": 74.71,
        "2002": 75.89,
        "2003": 77.61,
        "2004": 79.69,
        "2005": 82.4,
        "2006": 85.05,
        "2007": 87.48,
        "2008": 90.84,
        "2009": 90.52,
        "2010": 92,
        "2011": 94.9,
        "2012": 96.87,
        "2013": 98.29,
        "2014": 99.88,
        "2015": 100,
        "2016": 101.26,
        "2017": 103.42,
        "2018": 105.94,
        "2019": 107.86,
        "2020": 109.2,
        "2021": 114.33,
        "2022": 123.47,
        "2023": 128.56,
        "2024": 132.35,
        "2025": 135.83
      }
    },
    "SEK": {
      "geo": "SE",
      "label": {
        "en": "Sweden",
        "ro": "Suedia"
      },
      "index": {
        "1996": 76.16,
        "1997": 77.54,
        "1998": 78.32,
        "1999": 78.76,
        "2000": 79.78,
        "2001": 81.92,
        "2002": 83.51,
        "2003": 85.44,
        "2004": 86.32,
        "2005": 87.03,
        "2006": 88.34,
        "2007": 89.82,
        "2008": 92.83,
        "2009": 94.63,
        "2010": 96.43,
        "2011": 97.75,
        "2012": 98.66,
        "2013": 99.1,
        "2014": 99.3,
        "2015": 100,
        "2016": 101.14,
        "2017": 103.02,
        "2018": 105.12,
        "2019": 106.93,
        "2020": 107.63,
        "2021": 110.49,
        "2022": 119.39,
        "2023": 126.44,
        "2024": 128.98,
        "2025": 132.35
      }
    }
  }
}
